{
  "$schema": "./schema.json",
  "locale": "ne",
  "name": "नेपाली",
  "direction": "ltr",
  "translations": {
    "site": {
      "title": "मनोज दाहाल — AI इन्जिनियर",
      "tagline": "बुद्धिमत्ताको भविष्य निर्माण",
      "description": "AI प्रणाली, इमर्सिभ 3D अनुभवहरू, फ्युचरिस्टिक OS अवधारणाहरू, र अर्को पुस्ताका डिजिटल उत्पादनहरू।"
    },
    "nav": {
      "home":     "गृह",
      "about":    "मेरो बारेमा",
      "skills":   "सीपहरू",
      "projects": "कार्यहरू",
      "process":  "प्रक्रिया",
      "contact":  "सम्पर्क",
      "cta":      "कुरा गरौं"
    },
    "hero": {
      "greeting": "नमस्ते, म हुँ",
      "intro": "म मनोज दाहाल हुँ, एक जुनूनी प्रविधि सिर्जनाकार",
      "highlights": {
        "ai":    "बुद्धिमान सफ्टवेयर",
        "os":    "फ्युचरिस्टिक AI प्रणाली",
        "core":  "अपरेटिङ सिस्टम",
        "algo":  "उन्नत एल्गोरिदम",
        "ux":    "इमर्सिभ प्रयोगकर्ता अनुभव",
        "ng":    "अर्को पुस्ताका डिजिटल उत्पादनहरू"
      },
      "viewWork": "मेरो काम हेर्नुहोस्",
      "contact":  "सम्पर्क गर्नुहोस्"
    },
    "footer": {
      "navigate": "नेभिगेट",
      "connect":  "जडान",
      "tagline":  "बुद्धिमान प्रणाली, इमर्सिभ अनुभव र फ्युचरिस्टिक डिजिटल उत्पादनहरू निर्माण।",
      "copyright":"© {{year}} मनोज दाहाल · शुद्धताका साथ बनाइएको"
    }
  }
}
